13,ACM Conference on Computer Supported Cooperative Work,CSCW,CORE2013,A,No,0806,,
17,ACM Conference on Hypertext and Social Media,Hypertext,CORE2013,A,Yes,0805,,
24,ACM International Conference on Emerging Networking Experiments and Technologies,CoNEXT,CORE2013,A,No,0805,,
25,ACM International Conference on Information and Knowledge Management,CIKM,CORE2013,A,Yes,0806,0807,
30,ACM International Conference on Supercomputing,ICS,CORE2013,A,Yes,0805,,
52,"ACM International Conference on the Foundations of Software Engineering (was ESEC/FSE, changed 2024; duplicate previously listed as ESEC, removed from DB)",FSE,CORE2013,A,Yes,0803,,
33,ACM International Symposium on High Performance Distributed Computing,HPDC,CORE2013,A,No,0805,,
49,"ACM SIGPLAN Conference on Languages, Compilers and Tools for Embedded Systems",LCTES,CORE2013,A,Yes,1005,,
55,ACM Special Interest Group on Computer Science Education Conference,SIGCSE,CORE2013,A,Yes,0899,,
2003,ACM Symposium on Document Engineering,DocEng,CORE2013,A,Yes,0806,,
58,ACM Symposium on Mobile Ad Hoc Networking and Computing,MOBIHOC,CORE2013,A,Yes,0804,,
2137,ACM Symposium on Software Reusability ,SSR,CORE2013,A,No,0803,,
66,ACM Symposium on User Interface Software and Technology,UIST,CORE2013,A,Yes,0806,,
67,ACM Virtual Reality Software and Technology,VRST,CORE2013,A,Yes,0801,,
69,ACM Workshop on Hot Topics in Networks,HOTNETS,CORE2013,A,No,1005,,
76,"ACM/IEEE International Conference on Modelling, Analysis and Simulation of Wireless and Mobile Systems",MSWIM,CORE2013,A,Yes,1006,,
79,ACM/IFIP/USENIX International Middleware Conference,Middleware,CORE2013,A,Yes,0803,,
81,ACM/SPIE Multimedia Computing and Networking,MMCN,CORE2013,A,No,0801,,
97,Advances in Modal Logic,AiML,CORE2013,A,Yes,0802,,
106,Algorithmic Learning Theory,ALT,CORE2013,A,Yes,0802,,
108,Algorithms and Data Structures Symposium (was Workshop on Algorithms and Data Structures),WADS,CORE2013,A,Yes,0802,,
1968,American Medical Informatics Annual Fall Symposium,AMIA,CORE2013,A,No,0806,,
115,Americas Conference on Information Systems,AMCIS,CORE2013,A,No,0806,,
117,Annual Computer Security Applications Conference,ACSAC,CORE2013,A,Yes,0803,,
123,Annual Conference of the International Speech Communication Association (was Eurospeech),Interspeech,CORE2013,A,No,0801,,
126,Annual Conference on Innovation and Technology in Computer Science Education,ITiCSE,CORE2013,A,Yes,0899,,
120,Annual Meeting of the Cognitive Science Society,CogSci,CORE2013,A,Yes,0801,,
139,AoM Organizational Communication and Information Systems,OCIS,CORE2013,A,No,0806,,
141,Application of Computers and Operations Research in the Minerals Industries,APCOMin,CORE2013,A,No,0909,0914,
150,Artificial Intelligence in Medicine,AIIM,CORE2013,A,No,0801,,
191,Aspect-Oriented Software Development,AOSD,CORE2013,A,No,0803,,
279,Automated Software Engineering Conference,ASE,CORE2013,A,Yes,0803,,
371,Conference on Computational Natural Language Learning,CoNLL,CORE2013,A,Yes,0801,,
1839,Conference on File and Storage Technologies,FAST,CORE2013,A,No,0804,,
369,Conference on Innovative Data Systems Research,CIDR,CORE2013,A,No,0806,,
370,Conference on Integer Programming and Combinatorial Optimization,IPCO,CORE2013,A,Yes,0802,,
1245,"Conference on Interactive Theorem Proving (previously TPHOLs, changed in 2009)",ITP,CORE2013,A,Yes,0802,,
383,Conference on the Quality of Software Architectures,QoSA,CORE2013,A,Yes,0803,,
2004,Deductive and Object-Oriented Databases,DOOD,CORE2013,A,No,0806,,
1996,Design Automation Conf,DAC,CORE2013,A,Yes,,,
448,Empirical Methods in Natural Language Processing,EMNLP,CORE2013,A,Yes,0801,,
2011,Engineering Applications of Artifical Intelligence ,EAAI,CORE2013,A,No,0801,,
463,Euromicro Conference on Real-Time Systems,ECRTS,CORE2013,A,Yes,1005,,
468,European Association for Computational Linguistics,EACL,CORE2013,A,Yes,0801,,
473,European Conference on Artificial Intelligence,ECAI,CORE2013,A,Yes,0801,,
479,European Conference on Computer Vision,ECCV,CORE2013,A,Yes,0801,,
484,European Conference on Information Systems,ECIS,CORE2013,A,No,0806,,
486,European Conference on Machine Learning (Joined with PKDD from 2008),ECML,CORE2013,A,No,0801,,
491,European Conference on Machine Learning and Principles and Practice of Knowledge Discovery in Database (PKDD and ECML combined from 2008),ECML PKDD,CORE2013,A,Yes,0804,,
488,European Conference on Object-Oriented Programming,ECOOP,CORE2013,A,Yes,0803,,
499,European Graphics Conference,EUROGRAPH,CORE2013,A,No,0801,,
511,European Symposium on Algorithms,ESA,CORE2013,A,Yes,0802,,
514,European Symposium on Programming,ESOP,CORE2013,A,Yes,0803,,
515,European Symposium On Research In Computer Security,ESORICS,CORE2013,A,Yes,0803,,
525,Eurosys Conference,EuroSys,CORE2013,A,Yes,0803,,
2021,Extended Semantic Web Conference (was European Semantic Web Conference),ESWC,CORE2013,A,Yes,1005,,
528,Extending Database Technology,EDBT,CORE2013,A,Yes,0804,,
533,Financial Cryptography and Data Security Conference,FC,CORE2013,A,Yes,0804,,
556,Genetic and Evolutionary Computations,GECCO,CORE2013,A,Yes,08,09,
572,Graph Drawing,GD,CORE2013,A,Yes,0802,,
575,Hawaii International Conference on System Sciences,HICSS,CORE2013,A,No,0806,,
597,IEEE Computational Systems Bioinformatics Conference,CSB,CORE2013,A,No,0803,,
599,IEEE Computer Security Foundations Symposium (was CSFW),CSF,CORE2013,A,Yes,0803,,
604,IEEE Conference on Computer Vision and Pattern Recognition,CVPR,CORE2013,A,Yes,0801,,
605,IEEE Conference on Decision and Control,CDC,CORE2013,A,No,1005,,
607,IEEE Conference on Local Computer Networks,LCN,CORE2013,A,Yes,1006,,
2110,IEEE Conference on Open Architecture and Network Programming,OPENARCH,CORE2013,A,No,0805,,
2061,IEEE Congress on Evolutionary Computation,CEC,CORE2013,A,Yes,0801,,
632,IEEE International Conference on Cluster Computing,CLUSTER,CORE2013,A,Yes,0805,,
2045,IEEE International Conference on Computer Languages,ICCL,CORE2013,A,No,0803,,
2047,IEEE International Conference on Document Analysis and Recognition,ICDAR,CORE2013,A,Yes,0806,,
648,IEEE International Conference on e-Science and Grid Computing,e-Science,CORE2013,A,Yes,0805,,
646,IEEE International Conference on Engineering of Complex Computer Systems,ICECCS,CORE2013,A,Yes,1005,,
649,IEEE International Conference on Fuzzy Systems,FUZZ-IEEE,CORE2013,A,Yes,0801,,
2063,IEEE International Conference on Multimedia Computing and Systems,ICMCS,CORE2013,A,No,0806,,
676,"IEEE International Conference on Software Maintenance and Evolution (prior to 2014 was ICSM, IEEE International Conference on Software Maintenance)",ICSME,CORE2013,A,Yes,0803,,
674,IEEE International Conference on Software Services Engineering (previously IEEE International Conference on Services Computing SCC),IEEE SSE,CORE2013,A,Yes,0806,,
678,IEEE International Conference on Web Services,ICWS,CORE2013,A,Yes,0806,,
685,IEEE International Joint Conference on Neural Networks,IJCNN,CORE2013,A,Yes,0801,,
688,IEEE International Parallel and Distributed Processing Symposium (was IPPS and SPDP),IPDPS,CORE2013,A,Yes,0805,,
690,IEEE International Requirements Engineering Conference,RE,CORE2013,A,Yes,0803,,
2081,IEEE International Solid-State Circuits Conference,ISSCC,CORE2013,A,No,,,
691,"IEEE International Symposium on a World of Wireless, Mobile and Multimedia Networks",WoWMoM,CORE2013,A,Yes,1006,,
693,IEEE International Symposium on Artificial Life,IEEE Alife,CORE2013,A,Yes,0801,,
695,"IEEE International Symposium on Cluster, Cloud and Grid Computing",CCGRID,CORE2013,A,Yes,0805,,
702,IEEE International Symposium on Network Computing and Applications,NCA,CORE2013,A,Yes,0805,,
2135,IEEE International Symposium on Software Metrics ,SMS,CORE2013,A,No,0803,,
725,IEEE Real-Time and Embedded Technology and Applications Symposium,RTAS,CORE2013,A,Yes,1006,,
2026,IEEE Symposium on Field Programmable Custom Computing Machines,FCCM,CORE2013,A,Yes,0803,,
750,IEEE Symposium on Security and Privacy,SP,CORE2013,A,Yes,0802,0803,
752,IEEE Symposium on Visual Languages and Human-Centric Computing (was VL),VL/HCC,CORE2013,A,Yes,0806,,
2064,IEEE Transactions on Knowledge and Data Engineering,IEEETKDE,CORE2013,A,No,0806,0801,
759,IEEE Visualization,IEEE VIS,CORE2013,A,Yes,0801,,
763,IEEE Workshop on Applications of Computer Vision,WACV,CORE2013,A,Yes,0801,,
783,IEEE/ACM International Conference on Computer-Aided Design,ICCAD,CORE2013,A,Yes,0801,,
784,IEEE/ACM International Conference on Grid Computing,GRID,CORE2013,A,No,0805,,
792,IEEE/RSJ International Conference on Intelligent Robots and Systems,IROS,CORE2013,A,Yes,0913,0910,0801
806,IFIP International Conference on Networking,Networking,CORE2013,A,Yes,1006,,
2116,"IFIP International Symposium on Computing Performance, Modelling, Measurement and Evaluation",PERFORMANCE,CORE2013,A,Yes,0803,,
805,"IFIP Joint International Conference on Formal Description Techniques and Protocol Specification, Testing, And Verification",FORTE,CORE2013,A,Yes,0803,,
807,IFIP TC13 Conference on Human-Computer Interaction,Interact,CORE2013,A,Yes,0806,1203,
2067,IFIP WG 11.3 Working Conference on Data and Applications Security (also known as DBSEC),DBSEC,CORE2013,A,Yes,0803,0805,
812,IFIP/IEEE International Symposium on Integrated Management (even years sharing with NOMS),IM,CORE2013,A,Yes,1006,,
845,Intelligent Data Analysis,IDA,CORE2013,A,Yes,0804,,
847,Intelligent Systems in Molecular Biology,ISMB,CORE2013,A,Yes,0803,,
864,International Colloquium on Automata Languages and Programming,ICALP,CORE2013,A,Yes,0802,,
2052,International Computer Symposium Conference,ICSC2,CORE2013,A,No,,,
77,"International Conference for High Performance Computing, Networking, Storage and Analysis (was Supercomputing Conference)",SC,CORE2013,A,No,0805,,
878,International Conference in Business Process Management,BPM,CORE2013,A,No,0806,,
2040,International Conference of Asian Digital Libraries,ICADL,CORE2013,A,No,,,
891,International Conference on Advanced Information Systems Engineering,CaiSE,CORE2013,A,Yes,0806,,
1960,International Conference on AI in Design,AID,CORE2013,A,No,0801,,
908,"International Conference on Application-specific Systems, Architectures and Processors",ASAP,CORE2013,A,No,0805,,
1961,International Conference on Artificial Intelligence in Education,AIED,CORE2013,A,Yes,0801,,
151,International Conference on Artificial Intelligence in Medicine,AIME,CORE2013,A,Yes,0801,,
918,International Conference on Automated Deduction,CADE,CORE2013,A,Yes,0801,,
936,International Conference on Compiler Construction,CC,CORE2013,A,Yes,0803,,
937,"International Conference on Compilers, Architecture, and Synthesis for Embedded Systems",CASES,CORE2013,A,Yes,1006,,
949,International Conference on Computational Linguistics,COLING,CORE2013,A,Yes,0801,,
952,International Conference on Computational Science,ICCS,CORE2013,A,Yes,0802,,
2038,International Conference on Computer Communication and Networks,ICCCN,CORE2013,A,Yes,0805,,
969,International Conference on Computing and Combinatorics,COCOON,CORE2013,A,No,0802,,
971,International Conference on Conceptual Modelling,ER,CORE2013,A,Yes,0804,,
973,International Conference on Concurrency Theory,CONCUR,CORE2013,A,Yes,0802,,
977,"International Conference on Control, Automation, Robotics and Vision",ICARCV,CORE2013,A,Yes,0801,,
979,International Conference on Cooperative Information Systems,CoopIS,CORE2013,A,Yes,0806,,
980,International Conference on Coordination Models and Languages,Coordination,CORE2013,A,Yes,0803,,
989,International Conference on Database Theory,ICDT,CORE2013,A,Yes,0804,,
993,International Conference on Design Science Research in Information Systems and Technology,DESRIST,CORE2013,A,No,0806,,
1002,International Conference on Distributed Computing Systems,ICDCS,CORE2013,A,Yes,0805,,
16,International Conference on Embedded Software,EMSOFT,CORE2013,A,Yes,1005,,
497,International Conference on Embedded Wireless Systems and Networks (wasEuropean Conference on Wireless Sensor Networks),EWSN,CORE2013,A,Yes,1005,,
1022,International Conference on Evaluation and Assessment in Software Engineering,EASE,CORE2013,A,Yes,0803,,
1028,International Conference on Field and Service Robotics,FSR,CORE2013,A,No,0801,0910,
1033,International Conference on Formal Ontology in Information Systems,FOIS,CORE2013,A,Yes,0806,,
1034,International Conference on Foundation on Data Organization,FODO,CORE2013,A,No,0804,,
1048,International Conference on High Performance Computing,HiPC,CORE2013,A,Yes,0805,,
1080,International Conference on Information Systems Development,ISD,CORE2013,A,No,0806,,
1100,International Conference on Intelligent Tutoring Systems,ITS,CORE2013,A,Yes,0801,,
1101,International Conference on Intelligent User Interfaces,IUI,CORE2013,A,Yes,0806,,
1119,International Conference on Logic Programming,ICLP,CORE2013,A,Yes,0802,,
1120,International Conference on Logic Programming and Non-monotonic Reasoning,LPNMR,CORE2013,A,Yes,0802,,
1131,International Conference on Mobile and Ubiquitous Systems: Networks and Services,Mobiquitous,CORE2013,A,Yes,0805,,
1147,International Conference on Network Protocols,ICNP,CORE2013,A,Yes,1006,,
1152,International Conference on Neural Information Processing,ICONIP,CORE2013,A,Yes,0801,,
1165,International Conference on Parallel Architecture and Compilation Techniques,PACT,CORE2013,A,Yes,0805,,
1167,International Conference on Parallel Processing,ICPP,CORE2013,A,Yes,0805,,
1175,International Conference on Principles and Practice of Constraint Programming,CP,CORE2013,A,Yes,0803,,
1191,International Conference on Reliable Software Technologies,Ada-Europe,CORE2013,A,Yes,0803,,
2123,International Conference on Rewriting Techniques and Applications (now merged with FSCD Formal Structures for Computation and Deduction),RTA,CORE2013,A,No,0802,,
1197,International Conference on Scientific and Statistical Data Base Management,SSDBM,CORE2013,A,Yes,0804,,
1198,International Conference on Security and Privacy for Communication Networks,SecureComm,CORE2013,A,Yes,0803,,
1199,International Conference on Security in Pervasive Computing,ICSPC,CORE2013,A,No,0806,,
1204,International Conference on Service Oriented Computing,ICSOC,CORE2013,A,Yes,0805,,
1217,International Conference on Software and System Processes (was ICSP prior to 2011),ICSSP,CORE2013,A,Yes,0803,,
791,International Conference on Software Architecture (was previously WICSA),ICSA,CORE2013,A,Yes,0803,,
1220,International Conference on Software Reuse,ICSR,CORE2013,A,Yes,0803,,
1235,International Conference on Temporal Logic,ICTL,CORE2013,A,No,0802,,
1240,International Conference on the Simulation and Synthesis of Living Systems,ALIFE,CORE2013,A,Yes,0801,,
1243,International Conference on the Theory and Application of Cryptology and Information Security,ASIACRYPT,CORE2013,A,Yes,0804,,
1246,International Conference on Theorem Proving with Analytic Tableaux and Related Methods,TABLEAUX,CORE2013,A,Yes,0802,,
1250,International Conference on Theory and Applications of Satisfiability Testing,SAT,CORE2013,A,Yes,0802,,
2013,International Conference on Theory and Practice of Digital Libraries (was ECDL until 2010),TPDL,CORE2013,A,Yes,,,
790,"International Conference on Trust, Security and Privacy in Computing and Communications",TrustCom,CORE2013,A,Yes,0803,,
1262,International Conference on Virtual Execution Environments,VEE,CORE2013,A,Yes,0803,,
1271,International Conference on Web Information Systems Engineering,WISE,CORE2013,A,Yes,0805,,
2022,International European Conference on Parallel and Distributed Computing (was International Conference on Parallel Processing),EuroPar,CORE2013,A,Yes,,,
1318,International Joint Conference on Qualitative and Quantitative Practical Reasoning,ESQARU,CORE2013,A,No,0801,,
2069,International Logic Programming Symposium,ILPS,CORE2013,A,No,0801,,
1338,International Semantic Web Conference,ISWC,CORE2013,A,Yes,0804,,
1341,International Symposium Component-Based Software Engineering,CBSE,CORE2013,A,Yes,0803,,
1349,International Symposium on Algorithms and Computation,ISAAC,CORE2013,A,Yes,0802,,
1357,International Symposium on Automated Technology for Verification and Analysis,ATVA,CORE2013,A,Yes,0803,,
1362,International Symposium on Code Generation and Optimization,CGO,CORE2013,A,No,0803,,
60,International Symposium on Computational Geometry,SoCG,CORE2013,A,Yes,0802,,
1374,International Symposium on Distributed Computing (was WDAG),DISC,CORE2013,A,Yes,0805,,
1376,International Symposium on Empirical Software Engineering and Measurement,ESEM,CORE2013,A,Yes,0803,,
540,International Symposium on Formal Methods (was Formal Methods Europe FME),FM,CORE2013,A,Yes,0802,,
1382,International Symposium on Functional and Logic Programming,FLOPS,CORE2013,A,No,0802,,
1383,International Symposium on Fundamentals of Computation Theory,FCT,CORE2013,A,Yes,0802,,
1398,International Symposium on Mathematical Foundations of Computer Science,MFCS,CORE2013,A,Yes,0802,,
1400,International Symposium on Memory Management,ISMM,CORE2013,A,Yes,0803,,
2098,International Symposium on Microarchitecture,MICRO,CORE2013,A,Yes,0803,,
1409,International Symposium on Robotics,ISR,CORE2013,A,No,0801,0910,
1410,International Symposium on Robotics Research,ISRR,CORE2013,A,Yes,0910,0801,
1411,International Symposium on Software Reliability Engineering,ISSRE,CORE2013,A,Yes,0803,,
1412,International Symposium on Software Testing and Analysis,ISSTA,CORE2013,A,Yes,0803,,
1416,International Symposium on Spatial and Temporal Databases,SSTD,CORE2013,A,Yes,0804,0909,
1424,International Symposium on Temporal Representation and Reasoning,TIME,CORE2013,A,Yes,0802,,
1451,International Workshop on Approximation Algorithms for Combinatorial Optimization Problems and International Conference on Randomization and Computation,APPROX/RANDOM,CORE2013,A,Yes,0802,,
1484,International Workshop on Graph-Theoretic Concepts in Computer Science,WG,CORE2013,A,Yes,0802,,
1518,International Workshop on Randomization and Computation,RANDOM,CORE2013,A,Yes,0802,,
1529,International Workshop on Software and Compilers for Embedded Systems,SCOPES,CORE2013,A,Yes,1005,,
1551,Internet Measurement Conference,IMC,CORE2013,A,No,0806,,
494,Interspeech (combined EuroSpeech and ICSLP in 2000),Interspeech,CORE2013,A,No,0801,,
958,"Joint Conference on Computer Vision, Imaging and Computer Graphics Theory and Applications (GRAPP and VISAPP combined from 2008)",VISIGRAPP,CORE2013,A,Yes,0801,,
1582,Knowledge capture,K-CAP,CORE2013,A,Yes,0804,,
1596,Logic Programming and Automated Reasoning,LPAR,CORE2013,A,Yes,0802,,
1598,"Logics in Artificial Intelligence, European Conference",JELIA,CORE2013,A,Yes,0802,,
1607,Medical Image Computing and Computer-Assisted Intervention,MICCAI,CORE2013,A,Yes,0801,0903,
2104,"Net Object Days (Includings MATES, ENASE etc.)",MATES ENASE,CORE2013,A,No,,,
1638,Network and Operating System Support for Digital Audio and Video,NOSSDAV,CORE2013,A,Yes,0806,,
2105,Network Storage Symposium,NetStore,CORE2013,A,No,0805,,
1648,North American Association for Computational Linguistics,NAACL,CORE2013,A,Yes,0801,,
1657,Pacific Asia Conference on Information Systems,PACIS,CORE2013,A,No,0806,,
1660,Pacific Conference on Computer Graphics and Applications,PG,CORE2013,A,Yes,0801,,
1667,Pacific-Asia Conference on Knowledge Discovery and Data Mining,PAKDD,CORE2013,A,Yes,0804,,
1676,Parallel Problem Solving from Nature,PPSN,CORE2013,A,Yes,0801,,
2120,Performance Tools - International Conference on Model Techniques & Tools for CPE,PT,CORE2013,A,No,0803,,
1691,Principles and Practice of Parallel Programming,PPoPP,CORE2013,A,Yes,0805,,
1727,SIAM International Conference on Data Mining,SDM,CORE2013,A,Yes,0804,,
2136,Software Process Improvement and Capability Determination ,SPICE,CORE2013,A,Yes,0803,,
1763,Static Analysis Symposium,SAS,CORE2013,A,Yes,0802,,
1766,Structural and Syntactical Pattern Recognition,SSPR,CORE2013,A,Yes,0802,,
1770,Symposia on VLSI Technology and Circuits,VLSI,CORE2013,A,No,1005,,
1771,Symposium Model Analysis and Simulation of Computer and Telecommunications Systems,MASCOTS,CORE2013,A,Yes,1006,,
2093,Symposium on Frontiers of Massively Parallel Processing,MassPar,CORE2013,A,No,0805,,
2033,Symposium on High Performance Chips ,HOTCHIPS (HCS),CORE2013,A,Yes,,,
1790,Symposium on Parallelism in Algorithms and Architectures,SPAA,CORE2013,A,Yes,0805,,
1792,Symposium on Reliable Distributed Systems,SRDS,CORE2013,A,Yes,0805,,
1798,"Tangible, Embedded, and Embodied Interaction",TEI,CORE2013,A,Yes,0806,,
1814,Theoretical Aspects of Rationality and Knowledge,TARK,CORE2013,A,Yes,0802,,
1815,Theory of Cryptography Conference,TCC,CORE2013,A,Yes,0804,,
1818,Tools and Algorithms for Construction and Analysis of Systems,TACAS,CORE2013,A,Yes,0803,,
2144,Unix Symposium on Internet Technologies,USITS,CORE2013,A,No,0805,,
2124,Unix Symposium on Operating Systems Design and Implementation ,SDSDI,CORE2013,A,No,0803,,
1838,Usenix Annual Technical Conference,USENIX,CORE2013,A,No,08,,
1840,Usenix Network and Distributed System Security Symposium,NDSS,CORE2013,A,Yes,0803,0805,
1841,Usenix Security Symposium,USENIX-Security,CORE2013,A,Yes,0803,,
1845,USENIX Workshop on Hot Topics in Operating Systems,HotOS,CORE2013,A,Yes,0803,,
1870,Workshop on Algorithm Engineering and Experiments,ALENEX,CORE2013,A,Yes,0802,,
